{
  "dependencies": [
    "@chakra-ui/react"
  ],
  "files": [
    {
      "content": "export { NumberInput } from './number-input.tsx'\nexport type { NumberInputProps } from './number-input.tsx'\n",
      "path": "ui/number-input/index.ts",
      "type": "registry:ui"
    },
    {
      "content": "'use client'\n\nimport { forwardRef } from 'react'\n\nimport { NumberInput as ChakraNumberInput } from '@chakra-ui/react/number-input'\n\nimport { InputGroup } from '../input-group/index.ts'\n\nexport interface NumberInputProps\n  extends Omit<ChakraNumberInput.RootProps, 'children'> {\n  rootRef?: React.Ref<HTMLDivElement>\n  hideControls?: boolean\n  startElement?: React.ReactNode\n  endElement?: React.ReactNode\n  inputProps?: React.InputHTMLAttributes<HTMLInputElement>\n}\n\nexport const NumberInput = forwardRef<HTMLInputElement, NumberInputProps>(\n  function NumberInput(props, ref) {\n    const {\n      hideControls,\n      startElement,\n      endElement,\n      inputProps,\n      rootRef,\n      ...rest\n    } = props\n    return (\n      <ChakraNumberInput.Root ref={rootRef} {...rest}>\n        <InputGroup\n          startElement={startElement}\n          endElement={endElement}\n          width=\"full\"\n        >\n          <ChakraNumberInput.Input ref={ref} {...inputProps} />\n        </InputGroup>\n\n        {!hideControls && !endElement ? (\n          <ChakraNumberInput.Control>\n            <ChakraNumberInput.IncrementTrigger />\n            <ChakraNumberInput.DecrementTrigger />\n          </ChakraNumberInput.Control>\n        ) : null}\n      </ChakraNumberInput.Root>\n    )\n  },\n)\n",
      "path": "ui/number-input/number-input.tsx",
      "type": "registry:ui"
    }
  ],
  "meta": {
    "compiler": {
      "client": true,
      "fileHashes": {
        "ui/number-input/index.ts": "f1f55680fd0cab094040d32280f7a90d5aebdcb339d1a2ab2ca4803c1fc0f708",
        "ui/number-input/number-input.tsx": "2398aac8b91feff0b927363e1761cd70b1647a9af493cb10aa04fc2daa5ad746"
      },
      "iconDependencies": [],
      "presetImports": [],
      "presetRecipeBindings": [],
      "recipeReferences": []
    },
    "contentHash": "92ac4918ec42297c912a4d942a9586793abc8f904d44e26390e01491b81328f4"
  },
  "name": "number-input",
  "registryDependencies": [
    "input-group"
  ],
  "schemaVersion": 1,
  "type": "registry:ui",
  "version": "3.0.0-next.9"
}
