{
  "dependencies": [
    "@chakra-ui/react"
  ],
  "files": [
    {
      "content": "export * as Stat from './stat.tsx'\n",
      "path": "ui/stat/index.ts",
      "type": "registry:ui"
    },
    {
      "content": "'use client'\n\nimport * as React from 'react'\n\nimport { Badge, type BadgeProps } from '@chakra-ui/react/badge'\nimport { FormatNumber } from '@chakra-ui/react/format'\nimport { Stat as ChakraStat } from '@chakra-ui/react/stat'\n\ninterface StatValueTextProps extends ChakraStat.ValueTextProps {\n  value?: number\n  formatOptions?: Intl.NumberFormatOptions\n}\n\nconst StatValueText = React.forwardRef<HTMLDivElement, StatValueTextProps>(\n  function StatValueText(props, ref) {\n    const { value, formatOptions, children, ...rest } = props\n    return (\n      <ChakraStat.ValueText {...rest} ref={ref}>\n        {children ||\n          (value != null && <FormatNumber value={value} {...formatOptions} />)}\n      </ChakraStat.ValueText>\n    )\n  },\n)\n\nconst StatUpTrend = React.forwardRef<HTMLDivElement, BadgeProps>(\n  function StatUpTrend(props, ref) {\n    return (\n      <Badge colorPalette=\"green\" gap=\"0\" {...props} ref={ref}>\n        <ChakraStat.UpIndicator />\n        {props.children}\n      </Badge>\n    )\n  },\n)\n\nconst StatDownTrend = React.forwardRef<HTMLDivElement, BadgeProps>(\n  function StatDownTrend(props, ref) {\n    return (\n      <Badge colorPalette=\"red\" gap=\"0\" {...props} ref={ref}>\n        <ChakraStat.DownIndicator />\n        {props.children}\n      </Badge>\n    )\n  },\n)\n\nexport const Root = ChakraStat.Root\nexport const Label = ChakraStat.Label\nexport const HelpText = ChakraStat.HelpText\nexport const ValueUnit = ChakraStat.ValueUnit\n\nexport type RootProps = ChakraStat.RootProps\nexport type ValueTextProps = StatValueTextProps\n\nexport {\n  StatValueText as ValueText,\n  StatUpTrend as UpTrend,\n  StatDownTrend as DownTrend,\n}\n",
      "path": "ui/stat/stat.tsx",
      "type": "registry:ui"
    }
  ],
  "meta": {
    "compiler": {
      "client": true,
      "fileHashes": {
        "ui/stat/index.ts": "c6966201ed7a83d6f91c9d05c693781cd49e49b1f27d7785810ad0794cf8be94",
        "ui/stat/stat.tsx": "284b44d47d376455740b65cd6d6724693528ac1e13f355a8b7efd9d66f86dfc7"
      },
      "iconDependencies": [],
      "presetImports": [],
      "presetRecipeBindings": [],
      "recipeReferences": []
    },
    "contentHash": "103a731e6bce657989723104567aefb73a7713554ab909071387306a8a08df6f"
  },
  "name": "stat",
  "schemaVersion": 1,
  "type": "registry:ui",
  "version": "3.0.0-rc.1"
}
