{
  "dependencies": [
    "@chakra-ui/react"
  ],
  "files": [
    {
      "content": "'use client'\n\nimport { forwardRef } from 'react'\n\nimport { ActionBar } from '@chakra-ui/react/action-bar'\nimport { Portal } from '@chakra-ui/react/portal'\n\nimport { CloseButton as CloseButtonBase } from '../close-button/index.ts'\n\ninterface ActionBarContentProps extends ActionBar.ContentProps {\n  portalled?: boolean\n  portalRef?: React.RefObject<HTMLElement>\n}\n\nconst ActionBarContent = forwardRef<HTMLDivElement, ActionBarContentProps>(\n  function ActionBarContent(props, ref) {\n    const { children, portalled = true, portalRef, ...rest } = props\n\n    return (\n      <Portal disabled={!portalled} container={portalRef}>\n        <ActionBar.Positioner>\n          <ActionBar.Content ref={ref} {...rest} asChild={false}>\n            {children}\n          </ActionBar.Content>\n        </ActionBar.Positioner>\n      </Portal>\n    )\n  },\n)\n\nconst ActionBarCloseButton = forwardRef<\n  HTMLButtonElement,\n  ActionBar.CloseTriggerProps\n>(function ActionBarCloseTrigger(props, ref) {\n  return (\n    <ActionBar.CloseTrigger {...props} asChild ref={ref}>\n      <CloseButtonBase size=\"sm\" />\n    </ActionBar.CloseTrigger>\n  )\n})\n\nexport const Root = ActionBar.Root\nexport const SelectionTrigger = ActionBar.SelectionTrigger\nexport const Separator = ActionBar.Separator\nexport const Content = ActionBarContent\nexport const CloseButton = ActionBarCloseButton\n\nexport type RootProps = ActionBar.RootProps\nexport type SelectionTriggerProps = ActionBar.SelectionTriggerProps\nexport type SeparatorProps = ActionBar.SeparatorProps\nexport type ContentProps = ActionBarContentProps\nexport type CloseTriggerProps = ActionBar.CloseTriggerProps\n",
      "path": "ui/action-bar/action-bar.tsx",
      "type": "registry:ui"
    },
    {
      "content": "export * as ActionBar from './action-bar.tsx'\n",
      "path": "ui/action-bar/index.ts",
      "type": "registry:ui"
    }
  ],
  "meta": {
    "compiler": {
      "client": true,
      "fileHashes": {
        "ui/action-bar/action-bar.tsx": "10364f3621c09cfe54fcc52b21285e67b83260c5433e1e8b91e3461df1c01929",
        "ui/action-bar/index.ts": "e7b0e8c4bd2b735b570f7984f0756d889e3edb966a324b85f71d4e4a13312024"
      },
      "iconDependencies": [],
      "presetImports": [],
      "presetRecipeBindings": [],
      "recipeReferences": []
    },
    "contentHash": "5f7da6190457cea4335b58854917d6aa06f9c65f944aace640b1bb679ae86608"
  },
  "name": "action-bar",
  "registryDependencies": [
    "close-button"
  ],
  "schemaVersion": 1,
  "type": "registry:ui",
  "version": "3.0.0-rc.0"
}
