{
  "files": [
    {
      "content": "import React from 'react';\n\nexport interface SearchIconProps extends React.SVGProps<SVGSVGElement> {\n  size?: number | string;\n}\n\n/**\n * search\n * Lucide\n * @url https://icon-sets.iconify.design/lucide\n * @license ISC\n */\nexport const SearchIcon: React.FC<SearchIconProps> = ({ \n  size = \"1em\", \n  ...props \n}) => {\n  return (\n    <svg\n      width={size}\n      height={size}\n      viewBox=\"0 0 24 24\"\n      fill=\"none\"\n      xmlns=\"http://www.w3.org/2000/svg\"\n      {...props}\n    >\n      <g fill=\"none\" stroke=\"currentColor\" stroke-linecap=\"round\" stroke-linejoin=\"round\" stroke-width=\"2\"><path d=\"m21 21l-4.34-4.34\"/><circle cx=\"11\" cy=\"11\" r=\"8\"/></g>\n    </svg>\n  );\n};\n",
      "path": "icons/search-icon.tsx",
      "type": "registry:icon"
    }
  ],
  "meta": {
    "compiler": {
      "client": false,
      "fileHashes": {
        "icons/search-icon.tsx": "f67feb43f39a5aa8986635f1f708e58113a423de5f122acd70f6245a8e077e6a"
      },
      "iconDependencies": [],
      "presetImports": [],
      "presetRecipeBindings": [],
      "recipeReferences": []
    },
    "componentName": "SearchIcon",
    "contentHash": "b74e5ed9d26e754b9d6ac55948c9ce33b6c3e893fb3ba50db528d8271ce19a2f",
    "iconName": "Search",
    "iconSet": "lucide"
  },
  "name": "search-icon",
  "schemaVersion": 1,
  "type": "registry:icon",
  "version": "3.0.0-next.9"
}
