{
  "dependencies": [
    "@chakra-ui/react"
  ],
  "files": [
    {
      "content": "'use client'\n\nimport * as React from 'react'\n\nimport { Accordion } from '@chakra-ui/react/accordion'\n\nimport { ChevronRightIcon } from '../../icons/chevron-right-icon'\n\nexport interface ItemTriggerProps extends Accordion.ItemTriggerProps {\n  indicatorIcon?: React.ReactNode\n  indicatorPlacement?: 'start' | 'end'\n}\n\nexport const ItemTrigger = React.forwardRef<\n  HTMLButtonElement,\n  ItemTriggerProps\n>(function AccordionItemTrigger(props, ref) {\n  const {\n    children,\n    indicatorPlacement = 'end',\n    indicatorIcon = <ChevronRightIcon />,\n    ...rest\n  } = props\n\n  const indicator = (\n    <Accordion.ItemIndicator>{indicatorIcon}</Accordion.ItemIndicator>\n  )\n\n  return (\n    <Accordion.ItemTrigger {...rest} ref={ref}>\n      {indicatorPlacement === 'start' && indicator}\n      {children}\n      {indicatorPlacement === 'end' && indicator}\n    </Accordion.ItemTrigger>\n  )\n})\n\nexport interface ItemContentProps extends Accordion.ItemContentProps {}\n\nexport const ItemContent = React.forwardRef<HTMLDivElement, ItemContentProps>(\n  function AccordionItemContent(props, ref) {\n    return (\n      <Accordion.ItemContent>\n        <Accordion.ItemBody {...props} ref={ref} />\n      </Accordion.ItemContent>\n    )\n  },\n)\n\nexport const Root = Accordion.Root\nexport const Item = Accordion.Item\n\nexport type RootProps = Accordion.RootProps\nexport type ItemProps = Accordion.ItemProps\n",
      "path": "ui/accordion/accordion.tsx",
      "type": "registry:ui"
    },
    {
      "content": "export * as Accordion from './accordion.tsx'\n",
      "path": "ui/accordion/index.ts",
      "type": "registry:ui"
    }
  ],
  "meta": {
    "compiler": {
      "client": true,
      "fileHashes": {
        "ui/accordion/accordion.tsx": "588c4b6ee3edab0ebc125fcad6d40011cced5d6ca383bb7732c95dd20d120475",
        "ui/accordion/index.ts": "a0d0ea4c72e8fbfefe0b6b7fb03d81987c6921f7b32a8521193a2b938a55c66c"
      },
      "iconDependencies": [
        "chevron-right-icon"
      ],
      "presetImports": [],
      "presetRecipeBindings": [],
      "recipeReferences": []
    },
    "contentHash": "ad2323d931b581a7394221b916abc2dae2962daa589a6431f688465a604e640b"
  },
  "name": "accordion",
  "registryDependencies": [
    "chevron-right-icon"
  ],
  "schemaVersion": 1,
  "type": "registry:ui",
  "version": "3.0.0-next.9"
}
