{
  "dependencies": [
    "@chakra-ui/react"
  ],
  "files": [
    {
      "content": "export * as Popover from './popover.tsx'\n",
      "path": "ui/popover/index.ts",
      "type": "registry:ui"
    },
    {
      "content": "'use client'\n\nimport { forwardRef } from 'react'\n\nimport { Popover as ChakraPopover } from '@chakra-ui/react/popover'\nimport { Portal } from '@chakra-ui/react/portal'\n\nimport { CloseButton, type CloseButtonProps } from '../close-button/index.ts'\n\ninterface PopoverContentProps extends ChakraPopover.ContentProps {\n  portalled?: boolean\n  portalRef?: React.RefObject<HTMLElement | null>\n}\n\nconst PopoverContent = forwardRef<HTMLDivElement, PopoverContentProps>(\n  function PopoverContent(props, ref) {\n    const { portalled = true, portalRef, ...rest } = props\n    return (\n      <Portal disabled={!portalled} container={portalRef}>\n        <ChakraPopover.Positioner>\n          <ChakraPopover.Content ref={ref} {...rest} />\n        </ChakraPopover.Positioner>\n      </Portal>\n    )\n  },\n)\n\nconst PopoverArrow = forwardRef<HTMLDivElement, ChakraPopover.ArrowProps>(\n  function PopoverArrow(props, ref) {\n    return (\n      <ChakraPopover.Arrow {...props} ref={ref}>\n        <ChakraPopover.ArrowTip />\n      </ChakraPopover.Arrow>\n    )\n  },\n)\n\ninterface PopoverCloseButtonProps\n  extends CloseButtonProps, ChakraPopover.CloseTriggerProps {}\n\nconst PopoverCloseButton = forwardRef<\n  HTMLButtonElement,\n  PopoverCloseButtonProps\n>(function PopoverCloseTrigger(props, ref) {\n  return (\n    <ChakraPopover.CloseTrigger ref={ref} asChild>\n      <CloseButton position=\"absolute\" top=\"1\" insetEnd=\"1\" {...props} />\n    </ChakraPopover.CloseTrigger>\n  )\n})\n\nconst PopoverCloseTrigger = ChakraPopover.CloseTrigger\nconst PopoverTitle = ChakraPopover.Title\nconst PopoverDescription = ChakraPopover.Description\nconst PopoverFooter = ChakraPopover.Footer\nconst PopoverHeader = ChakraPopover.Header\nconst PopoverRoot = ChakraPopover.Root\nconst PopoverBody = ChakraPopover.Body\nconst PopoverTrigger = ChakraPopover.Trigger\nconst PopoverContext = ChakraPopover.Context\n\nexport {\n  PopoverContent as Content,\n  PopoverArrow as Arrow,\n  PopoverCloseButton as CloseButton,\n  PopoverCloseTrigger as CloseTrigger,\n  PopoverTitle as Title,\n  PopoverDescription as Description,\n  PopoverFooter as Footer,\n  PopoverHeader as Header,\n  PopoverRoot as Root,\n  PopoverBody as Body,\n  PopoverTrigger as Trigger,\n  PopoverContext as Context,\n}\n\ntype PopoverRootProps = ChakraPopover.RootProps\n\nexport type { PopoverRootProps as RootProps }\n",
      "path": "ui/popover/popover.tsx",
      "type": "registry:ui"
    }
  ],
  "meta": {
    "compiler": {
      "client": true,
      "fileHashes": {
        "ui/popover/index.ts": "f81dc15035bc20db3bd111e068f6370e26ed372ef8273d69e813d2750e8c602f",
        "ui/popover/popover.tsx": "d0dbae3f7268138b799f8dbe6dc83f80e339738e1f01e6bdcaedde2bb0b775e0"
      },
      "iconDependencies": [],
      "presetImports": [],
      "presetRecipeBindings": [],
      "recipeReferences": []
    },
    "contentHash": "1859f812f386053eaec3d55557917b9af8baebfc8cac617e4271a1f512ae8fdd"
  },
  "name": "popover",
  "registryDependencies": [
    "close-button"
  ],
  "schemaVersion": 1,
  "type": "registry:ui",
  "version": "3.0.0-rc.1"
}
