{
  "dependencies": [
    "@chakra-ui/react",
    "@saas-ui/chakra-preset"
  ],
  "files": [
    {
      "content": "export { Theme, type AppearanceSeeds, type ThemeProps } from './theme.tsx'\n",
      "path": "ui/theme/index.ts",
      "type": "registry:ui"
    },
    {
      "content": "'use client'\n\nimport * as React from 'react'\n\nimport { type HTMLChakraProps, chakra } from '@chakra-ui/react'\nimport type { AppearanceOptions } from '@saas-ui/chakra-preset/appearance'\nimport type { ColorPalette } from '@saas-ui/chakra-preset/colors'\n\nexport type AppearanceSeeds = Pick<\n  AppearanceOptions,\n  'base' | 'accent' | 'sidebar'\n>\n\nconst cx = (...classNames: Array<string | undefined>) =>\n  classNames.filter(Boolean).join(' ')\n\ntype ThemeVariables = React.CSSProperties & {\n  '--scale-factor'?: number\n  '--overlay-effect'?: string\n  '--radius-control-factor'?: number\n  '--radius-panel-factor'?: number\n  '--radius-indicator-factor'?: number\n  '--sui-base'?: string\n  '--sui-accent'?: string\n  '--sui-sidebar'?: string\n  '--sui-sidebar-solid'?: string\n}\n\nexport interface ThemeProps extends HTMLChakraProps<'div'> {\n  /** The light or dark appearance applied to this subtree. */\n  appearance?: 'light' | 'dark' | undefined\n  /** Whether to apply the theme background and foreground colors. */\n  hasBackground?: boolean | undefined\n  /** The default color palette for components in this subtree. */\n  colorPalette?: ColorPalette | 'accent' | undefined\n  /** Scale factor consumed by Saas UI semantic radius tokens. */\n  scaleFactor?: number | undefined\n  /** Radius factor for controls such as Button, Input, and Select. */\n  controlRadius?: number | undefined\n  /** Radius factor for panels such as Drawer and Popover. */\n  panelRadius?: number | undefined\n  /** Radius factor for indicators such as Badge and Tag. */\n  indicatorRadius?: number | undefined\n  /** Backdrop effect consumed by Saas UI overlay layer styles. */\n  overlayEffect?: string | undefined\n  /** OKLCH appearance seeds (base, accent, sidebar) for this subtree. */\n  seeds?: AppearanceSeeds | undefined\n}\n\nexport const Theme = React.forwardRef<HTMLDivElement, ThemeProps>(\n  function Theme(props, ref) {\n    const {\n      appearance,\n      style,\n      className,\n      hasBackground = true,\n      scaleFactor = 1,\n      controlRadius = 1,\n      panelRadius = 1,\n      indicatorRadius = 1,\n      overlayEffect = 'blur(10px)',\n      seeds,\n      ...rest\n    } = props\n\n    const { base, accent, sidebar } = seeds ?? {}\n\n    const variables: ThemeVariables = {\n      '--scale-factor': scaleFactor,\n      '--overlay-effect': overlayEffect,\n      '--radius-control-factor': controlRadius,\n      '--radius-panel-factor': panelRadius,\n      '--radius-indicator-factor': indicatorRadius,\n    }\n\n    const sidebarSeed = sidebar === 'base' ? undefined : sidebar\n    const solidSidebar =\n      sidebarSeed && 'solid' in sidebarSeed && sidebarSeed.solid\n        ? sidebarSeed\n        : undefined\n    const tonalSidebar = sidebarSeed && !solidSidebar ? sidebarSeed : undefined\n\n    if (base) {\n      variables['--sui-base'] = `oklch(0.5 ${base.c ?? 0.012} ${base.h ?? 260})`\n    }\n    if (accent) {\n      variables['--sui-accent'] = `oklch(${accent.l} ${accent.c} ${accent.h})`\n    }\n    if (tonalSidebar) {\n      variables['--sui-sidebar'] =\n        `oklch(0.5 ${tonalSidebar.c ?? base?.c ?? 0.012} ${tonalSidebar.h ?? base?.h ?? 260})`\n    }\n    if (solidSidebar) {\n      variables['--sui-sidebar-solid'] =\n        `oklch(${solidSidebar.solid.l} ${solidSidebar.solid.c} ${solidSidebar.solid.h})`\n    }\n\n    const contrastAttribute = (contrast: string | undefined) =>\n      contrast === 'soft' || contrast === 'strong' ? contrast : undefined\n\n    return (\n      <chakra.div\n        color=\"fg\"\n        bg={hasBackground ? 'bg' : undefined}\n        colorPalette=\"gray\"\n        {...rest}\n        data-base-contrast={contrastAttribute(base?.contrast)}\n        data-accent-foreground={\n          accent?.foreground === 'dark' ? 'dark' : undefined\n        }\n        data-sidebar={solidSidebar ? 'solid' : undefined}\n        data-sidebar-foreground={\n          solidSidebar?.foreground === 'dark' ? 'dark' : undefined\n        }\n        data-sidebar-contrast={contrastAttribute(tonalSidebar?.contrast)}\n        className={cx('chakra-theme', 'sui-theme', appearance, className)}\n        style={{ ...style, colorScheme: appearance, ...variables }}\n        ref={ref}\n      />\n    )\n  },\n)\n",
      "path": "ui/theme/theme.tsx",
      "type": "registry:ui"
    }
  ],
  "meta": {
    "compiler": {
      "client": true,
      "fileHashes": {
        "ui/theme/index.ts": "225ca65fa37db5a32440b301c5e449f01392889ca2b1fc6be5d33bb95e7e3945",
        "ui/theme/theme.tsx": "7ef836013b320578081464f197d0dd99543c4e8cf0dca6c2c8cf0b21ada5398f"
      },
      "iconDependencies": [],
      "presetImports": [
        "@saas-ui/chakra-preset/appearance",
        "@saas-ui/chakra-preset/colors"
      ],
      "presetRecipeBindings": [],
      "recipeReferences": []
    },
    "contentHash": "24fa55602526812d5453bb777b6b488d118cf14d517bd002f1e37145c696df85"
  },
  "name": "theme",
  "schemaVersion": 1,
  "type": "registry:ui",
  "version": "3.0.0-rc.1"
}
