{
  "files": [
    {
      "content": "import React from 'react';\n\nexport interface ViewIconProps extends React.SVGProps<SVGSVGElement> {\n  size?: number | string;\n}\n\n/**\n * view\n * Lucide\n * @url https://icon-sets.iconify.design/lucide\n * @license ISC\n */\nexport const ViewIcon: React.FC<ViewIconProps> = ({ \n  size = \"1em\", \n  ...props \n}) => {\n  return (\n    <svg\n      width={size}\n      height={size}\n      viewBox=\"0 0 24 24\"\n      fill=\"none\"\n      xmlns=\"http://www.w3.org/2000/svg\"\n      {...props}\n    >\n      <g fill=\"none\" stroke=\"currentColor\" stroke-linecap=\"round\" stroke-linejoin=\"round\" stroke-width=\"2\"><path d=\"M2.062 12.348a1 1 0 0 1 0-.696a10.75 10.75 0 0 1 19.876 0a1 1 0 0 1 0 .696a10.75 10.75 0 0 1-19.876 0\"/><circle cx=\"12\" cy=\"12\" r=\"3\"/></g>\n    </svg>\n  );\n};\n",
      "path": "icons/view-icon.tsx",
      "type": "registry:icon"
    }
  ],
  "meta": {
    "compiler": {
      "client": false,
      "fileHashes": {
        "icons/view-icon.tsx": "3e2357726346e52a0471f062e61edbcc40eb1d9db0967f5bd06fe2c01a47702c"
      },
      "iconDependencies": [],
      "presetImports": [],
      "presetRecipeBindings": [],
      "recipeReferences": []
    },
    "componentName": "ViewIcon",
    "contentHash": "1045176bd42297f7dec107a8e9e4d19e1a56989178eb56bf258e68667fd8e1d9",
    "iconName": "Eye",
    "iconSet": "lucide"
  },
  "name": "view-icon",
  "schemaVersion": 1,
  "type": "registry:icon",
  "version": "3.0.0-next.9"
}
