{
  "files": [
    {
      "content": "import React from 'react'\n\nexport interface ViewOffIconProps extends React.SVGProps<SVGSVGElement> {\n  size?: number | string\n}\n\n/**\n * view-off\n * Lucide\n * @url https://icon-sets.iconify.design/lucide\n * @license ISC\n */\nexport const ViewOffIcon: React.FC<ViewOffIconProps> = ({\n  size = '1em',\n  ...props\n}) => {\n  return (\n    <svg\n      width={size}\n      height={size}\n      viewBox=\"0 0 24 24\"\n      fill=\"none\"\n      xmlns=\"http://www.w3.org/2000/svg\"\n      {...props}\n    >\n      <g\n        fill=\"none\"\n        stroke=\"currentColor\"\n        strokeLinecap=\"round\"\n        strokeLinejoin=\"round\"\n        strokeWidth=\"2\"\n      >\n        <path d=\"M10.733 5.076a10.744 10.744 0 0 1 11.205 6.575a1 1 0 0 1 0 .696a10.8 10.8 0 0 1-1.444 2.49m-6.41-.679a3 3 0 0 1-4.242-4.242\" />\n        <path d=\"M17.479 17.499a10.75 10.75 0 0 1-15.417-5.151a1 1 0 0 1 0-.696a10.75 10.75 0 0 1 4.446-5.143M2 2l20 20\" />\n      </g>\n    </svg>\n  )\n}\n",
      "path": "icons/view-off-icon.tsx",
      "type": "registry:icon"
    }
  ],
  "meta": {
    "compiler": {
      "client": false,
      "fileHashes": {
        "icons/view-off-icon.tsx": "e29500498454540f2fbce99c46cabfd359345f7d138147a9ee9b594036696cee"
      },
      "iconDependencies": [],
      "presetImports": [],
      "presetRecipeBindings": [],
      "recipeReferences": []
    },
    "componentName": "ViewOffIcon",
    "contentHash": "03a0bf903add9525e0c3ee43ddadf0bbb96ccfa25c17f61b3409dc960a4b1113",
    "iconName": "EyeOff",
    "iconSet": "lucide"
  },
  "name": "view-off-icon",
  "schemaVersion": 1,
  "type": "registry:icon",
  "version": "3.0.0-rc.1"
}
