{
  "files": [
    {
      "content": "import React from 'react';\n\nexport interface ChevronUpIconProps extends React.SVGProps<SVGSVGElement> {\n  size?: number | string;\n}\n\n/**\n * chevron-up\n * Lucide\n * @url https://icon-sets.iconify.design/lucide\n * @license ISC\n */\nexport const ChevronUpIcon: React.FC<ChevronUpIconProps> = ({ \n  size = \"1em\", \n  ...props \n}) => {\n  return (\n    <svg\n      width={size}\n      height={size}\n      viewBox=\"0 0 24 24\"\n      fill=\"none\"\n      xmlns=\"http://www.w3.org/2000/svg\"\n      {...props}\n    >\n      <path fill=\"none\" stroke=\"currentColor\" stroke-linecap=\"round\" stroke-linejoin=\"round\" stroke-width=\"2\" d=\"m18 15l-6-6l-6 6\"/>\n    </svg>\n  );\n};\n",
      "path": "icons/chevron-up-icon.tsx",
      "type": "registry:icon"
    }
  ],
  "meta": {
    "compiler": {
      "client": false,
      "fileHashes": {
        "icons/chevron-up-icon.tsx": "c7d63b748ccf2474054ba29248489b9e75751937ac02c9527c57dd79c904ac32"
      },
      "iconDependencies": [],
      "presetImports": [],
      "presetRecipeBindings": [],
      "recipeReferences": []
    },
    "componentName": "ChevronUpIcon",
    "contentHash": "59d8722ddeea560e5e0664782f7297d66da2b8bd76e0631cc20c91a8b57245a8",
    "iconName": "ChevronUp",
    "iconSet": "lucide"
  },
  "name": "chevron-up-icon",
  "schemaVersion": 1,
  "type": "registry:icon",
  "version": "3.0.0-next.9"
}
