{
  "files": [
    {
      "content": "import React from 'react';\n\nexport interface EyeOffIconProps extends React.SVGProps<SVGSVGElement> {\n  size?: number | string;\n}\n\n/**\n * eye-off\n * Lucide\n * @url https://icon-sets.iconify.design/lucide\n * @license ISC\n */\nexport const EyeOffIcon: React.FC<EyeOffIconProps> = ({ \n  size = \"1em\", \n  ...props \n}) => {\n  return (\n    <svg\n      width={size}\n      height={size}\n      viewBox=\"0 0 24 24\"\n      fill=\"none\"\n      xmlns=\"http://www.w3.org/2000/svg\"\n      {...props}\n    >\n      <g fill=\"none\" stroke=\"currentColor\" stroke-linecap=\"round\" stroke-linejoin=\"round\" stroke-width=\"2\"><path d=\"M10.733 5.076a10.744 10.744 0 0 1 11.205 6.575a1 1 0 0 1 0 .696a10.8 10.8 0 0 1-1.444 2.49m-6.41-.679a3 3 0 0 1-4.242-4.242\"/><path d=\"M17.479 17.499a10.75 10.75 0 0 1-15.417-5.151a1 1 0 0 1 0-.696a10.75 10.75 0 0 1 4.446-5.143M2 2l20 20\"/></g>\n    </svg>\n  );\n};\n",
      "path": "icons/eye-off-icon.tsx",
      "type": "registry:icon"
    }
  ],
  "meta": {
    "compiler": {
      "client": false,
      "fileHashes": {
        "icons/eye-off-icon.tsx": "71eee3fbc7559cf2205b6a7a8806c1d7179dfca9b06787678d7762b015be4f17"
      },
      "iconDependencies": [],
      "presetImports": [],
      "presetRecipeBindings": [],
      "recipeReferences": []
    },
    "componentName": "EyeOffIcon",
    "contentHash": "2916d26c217690e62b2134dbb2e60024708ff422e2cba53c6aa10bd1c3ab298e",
    "iconName": "EyeOff",
    "iconSet": "lucide"
  },
  "name": "eye-off-icon",
  "schemaVersion": 1,
  "type": "registry:icon",
  "version": "3.0.0-next.11"
}
